<?xml version="1.0" encoding="GBK"?>
<excel
xmlns="http://www.tjnetsky.com.cn"
xmlns:xsi="http://www.w3.org/2001/XMLSchema-instance"
xsi:schemaLocation="http://www.tjnetsky.com.cn excel-imp.xsd"
>
	<!-- 定义导入文件中表格信息 -->
	<tableInfo>
		<!-- 表格信息所在sheet位于excel文件中位置 -->
		<sheetNum>0</sheetNum>
		<!-- 数据开始行 -->
		<startRow>1</startRow>
		<endRow/>
		<endFlag></endFlag>
		<!-- 表名称，对应持久化对象名称 -->
		<tableName>Td21_mbk</tableName>
		<!-- 表名称,用于显示 -->
		<tableNameShow>资源信息批量导入</tableNameShow>
		<!-- 本表对应的父表信息 -->
		<fatherTables>
		</fatherTables>
		<!-- 当前表字段信息 -->
		<columns>
			<!-- byIndex:按列所在位置获取,byName: 按标题行名称获取-->
			<type>byName</type>
			<!-- 标题行位置 -->
			<titleRow>0</titleRow>
			<column>
					<columnName>ZYBH</columnName>
					<index/>
					<name>资源编号</name>
					<colName>资源编号</colName>
			</column>
			<column>
					<columnName>ZYMC</columnName>
					<index/>
					<name>资源名称</name>
					<colName>资源名称</colName>
			</column>
			<column>
					<columnName>JSXZ</columnName>
					<index/>
					<name>建设性质</name>
					<colName>建设性质</colName>
			</column>
			<column>
				<columnName>JSFS</columnName>
				<index/>
				<name>建设方式</name>
				<colName>建设方式</colName>
			</column>
			<column>
					<columnName>LB</columnName>
					<index/>
					<name>类别</name>
					<colName>类别</colName>
			</column>
			<column>
					<columnName>SSDQ</columnName>
					<index/>
					<name>所属地区</name>
					<colName>所属地区</colName>
			</column>
			<column>
					<columnName>SSWG</columnName>
					<index/>
					<name>所属网格</name>
					<colName>所属网格</colName>
			</column>
			<column>
					<columnName>ZLDD</columnName>
					<index/>
					<name>坐落地点</name>
					<colName>坐落地点</colName>
			</column>
			<column>
					<columnName>JD</columnName>
					<index/>
					<name>经度</name>
					<colName>经度</colName>
			</column>
			<column>
					<columnName>WD</columnName>
					<index/>
					<name>纬度</name>
					<colName>纬度</colName>
			</column>
			<column>
					<columnName>TDBM</columnName>
					<index/>
					<name>谈点部门</name>
					<colName>谈点部门</colName>
			</column>
			<column>
					<columnName>TDR</columnName>
					<index/>
					<name>谈点人</name>
					<colName>谈点人</colName>
			</column>
			<column>
					<columnName>TDRDH</columnName>
					<index/>
					<name>谈点人电话</name>
					<colName>谈点人电话</colName>
			</column> 
			<column>
					<columnName>LXR</columnName>
					<index/>
					<name>联系人</name>
					<colName>联系人</colName>
			</column>
			<column>
					<columnName>LXRDH</columnName>
					<index/>
					<name>联系人电话</name>
					<colName>联系人电话</colName>
			</column> 
			<column>
					<columnName>SFGJ</columnName>
					<index/>
					<name>是否共建</name>
					<colName>是否共建</colName>
			</column>
			<column>
					<columnName>TDXTF</columnName>
					<index/>
					<name>谈点协调费</name>
					<colName>谈点协调费</colName>
			</column>
			<column>
					<columnName>QYSJ</columnName>
					<index/>
					<name>签约时间</name>
					<colName>签约时间</colName>
			</column>
			<column>
					<columnName>ZJ</columnName>
					<index/>
					<name>租金</name>
					<colName>租金</colName>
			</column>
			<column>
					<columnName>NX</columnName>
					<index/>
					<name>年限</name>
					<colName>年限</colName>
			</column>
			<column>
					<columnName>HTBH</columnName>
					<index/>
					<name>合同编号</name>
					<colName>合同编号</colName>
			</column>
			<column>
					<columnName>YZMC</columnName>
					<index/>
					<name>业主姓名</name>
					<colName>业主姓名</colName>
			</column>
			<column>
					<columnName>YZDH</columnName>
					<index/>
					<name>业主电话</name>
					<colName>业主电话</colName>
			</column>
			<column>
					<columnName>SFSFK</columnName>
					<index/>
					<name>是否首付款</name>
					<colName>是否首付款</colName>
			</column>
			<column>
					<columnName>JSDJ</columnName>
					<index/>
					<name>建设等级</name>
					<colName>建设等级</colName>
			</column>
			<column>
					<columnName>TDZQ</columnName>
					<index/>
					<name>谈点周期</name>
					<colName>谈点周期</colName>
			</column>
			<column>
					<columnName>FKZQ</columnName>
					<index/>
					<name>反馈周期</name>
					<colName>反馈周期</colName>
			</column>
			<column>
					<columnName>KCSJ</columnName>
					<index/>
					<name>勘察时间</name>
					<colName>勘察时间</colName>
			</column>
			<column>
					<columnName>ZYPFSJ</columnName>
					<index/>
					<name>资源派发时间</name>
					<colName>资源派发时间</colName>
			</column>
		</columns>
	</tableInfo>
</excel>
