<?xml version="1.0" encoding="UTF-8"?>
<excel xmlns:xsi="http://www.w3.org/2001/XMLSchema-instance"
	xsi:schemaLocation="http://www.tjnetsky.com.cn excel-imp.xsd"><!--定义导入文件中表格信息-->
	<tableInfo><!--表格信息所在sheet位于excel文件中位置-->
		<sheetNum>0</sheetNum>
		<startRow>1</startRow>
		<endRow />
		<endFlag />
		<tableName>Td01_xmxx</tableName>
		<tableNameShow />
		<fatherTables />
		<columns><!--当前表字段信息-->
			<type>byName</type>
			<titleRow>0</titleRow> 
			<column>
				<columnName>XMMC</columnName>
				<index />
				<name>项目名称</name>
				<colName>项目名称</colName>
			</column>
			<column>
				<columnName>XMBH</columnName>
				<index />
				<name>项目编号</name>
				<colName>项目编号</colName>
			</column>
			<column>
				<columnName>SSDQ</columnName>
				<index />
				<name>所属地区</name>
				<colName>所属地区</colName>
			</column>
			<column>
				<columnName>XMGLY</columnName>
				<index />
				<name>项目经理</name>
				<colName>项目经理</colName>
			</column> 
			<column>
				<columnName>SGDW</columnName>
				<index />
				<name>施工单位</name>
				<colName>施工单位</colName>
			</column>
			<column>
				<columnName>SJJGSJ</columnName>
				<index />
				<name>竣工时间</name>
				<colName>竣工时间</colName>
			</column> 
			<column>
				<columnName>JSSJ</columnName>
				<index />
				<name>决算时间</name>
				<colName>决算时间</colName>
			</column> 
			<column>
				<columnName>XMZT</columnName>
				<index />
				<name>项目状态</name>
				<colName>项目状态</colName>
			</column> 
		</columns>
	</tableInfo>
</excel>